<?xml version="1.0" encoding="UTF-8"?>
<!DOCTYPE Admin_Info SYSTEM "Admin_Info.dtd">

<Admin_Info>
	<Admin  user_id="102">
	    <user_name>
			<first_name>Jim</first_name>
			<surname>Ryan</surname>
		</user_name>
		<user_role>System security</user_role>
		<user_privileges>
		<mechanic_ids>
			<mechanic_id>40391</mechanic_id>
			<mechanic_id>40392</mechanic_id>
			<mechanic_id>40393</mechanic_id>
			<mechanic_id>40394</mechanic_id>
			<mechanic_id>24829</mechanic_id>
		</mechanic_ids>
		<vehicle_ids>
			<vehicle_id>2019</vehicle_id>
			<vehicle_id>4930</vehicle_id>
			<vehicle_id>13984</vehicle_id>
			<vehicle_id>1246</vehicle_id>
			<vehicle_id>4958</vehicle_id>
		</vehicle_ids>
		</user_privileges>
	</Admin>

	<Admin user_id="202">
		<user_name>
			<first_name>Timmy</first_name>
			<surname>Bob</surname>
		</user_name>
		<user_role>System maintenance</user_role>
		<user_privileges>
			<mechanic_ids>
				<mechanic_id>40391</mechanic_id>
				<mechanic_id>40392</mechanic_id>
				<mechanic_id>40393</mechanic_id>
				<mechanic_id>40394</mechanic_id>
				<mechanic_id>24829</mechanic_id>
			</mechanic_ids>
			<vehicle_ids>
				<vehicle_id>2019</vehicle_id>
				<vehicle_id>4930</vehicle_id>
				<vehicle_id>13984</vehicle_id>
				<vehicle_id>1246</vehicle_id>
				<vehicle_id>4958</vehicle_id>
			</vehicle_ids>
		</user_privileges>
	</Admin>

	<Admin user_id="105">
		<user_name>
			<first_name>Fergus</first_name>
			<surname>Moyles</surname>
		</user_name>
		<user_role>Trainee Admin</user_role>
		<user_privileges>
		<vehicle_ids>
			<vehicle_id>2019</vehicle_id>
			<vehicle_id>4930</vehicle_id>
			<vehicle_id>13984</vehicle_id>
			<vehicle_id>1246</vehicle_id>
			<vehicle_id>4958</vehicle_id>
		</vehicle_ids>
		</user_privileges>
	</Admin>
</Admin_Info>